gender,race,residence,income,school_type,hooks,major,sat,ec_awards,essay_lor_interview,acceptances,waitlists,rejections,note,acceptances_clean,waitlists_clean,rejections_clean,num_acceptances,num_waitlists,num_rejections
F,WHITE,PA,Low,PUBLIC,NONE,ENG,1410,7.5,4.5,[],"['*UMICH', '*EMORY', '*TULANE']","['*DUKE', '*CMU', '*RICE', '*UNC CHAPEL HILL']",NA,,"UMICH, EMORY, TULANE","DUKE, CMU, RICE, UNC CHAPEL HILL",0,3,4
M,ASIAN,CA,High,PUBLIC,NONE,CS,1500,6.5,7.8,"['*PURDUE', '*UCSB', '*UCD', '*UIUC', '*BOSTON UNIVERSITY', '*San Jose State University', '*UVA']","['*UCLA', '*GEORGIA TECH', '*UMICH', '*NORTHEASTERN', '*UCI']","['*NORTHWESTERN', '*CORNELL', '*BERKELEY', '*DUKE', '*DARTMOUTH', '*CMU', '*RICE', '*UPENN']",NA,"PURDUE, UCSB, UCD, UIUC, BOSTON UNIVERSITY, San Jose State University, UVA","UCLA, GEORGIA TECH, UMICH, NORTHEASTERN, UCI","NORTHWESTERN, CORNELL, BERKELEY, DUKE, DARTMOUTH, CMU, RICE, UPENN",7,5,8
M,ASIAN,NY,Low,PUBLIC,FIRST-GEN,CS,1430,6,8.1,['*UMICH'],"['*NORTHWESTERN', '*UCSD', '*UCD']","['*UCLA', '*YALE', '*COLUMBIA', '*CORNELL', '*BERKELEY', '*PRINCETON', '*MIT', '*GEORGIA TECH', '*CMU', '*VANDERBILT', '*EMORY', '*BOSTON UNIVERSITY', '*NORTHEASTERN', '*TUFTS', '*UCHICAGO']",NA,UMICH,"NORTHWESTERN, UCSD, UCD","UCLA, YALE, COLUMBIA, CORNELL, BERKELEY, PRINCETON, MIT, GEORGIA TECH, CMU, VANDERBILT, EMORY, BOSTON UNIVERSITY, NORTHEASTERN, TUFTS, UCHICAGO",1,3,15
M,WHITE,CO,Low,NA,NONE,CS,1540,6.5,6.5,[],[],"['*HARVARD', '*YALE', '*COLUMBIA', '*DUKE', '*PRINCETON', '*RICE', '*UPENN']",NA,,,"HARVARD, YALE, COLUMBIA, DUKE, PRINCETON, RICE, UPENN",0,0,7
F,ASIAN,CA,Low,NA,NONE,CS,1530,6.5,3.75,"['*UCLA', '*UCSD', '*UIUC']","['*GEORGIA TECH', '*CMU', '*UCD', '*UCI']","['*MIT', '*CALTECH', '*NYU']",NA,"UCLA, UCSD, UIUC","GEORGIA TECH, CMU, UCD, UCI","MIT, CALTECH, NYU",3,4,3
M,ASIAN,IN,Low,PRIVATE,NONE,NA,1550,7.5,8.3,"['*UMICH', '*BOSTON COLLEGE', '*FORDHAM']","['*UPENN', '*WASHU']","['*HARVARD', '*YALE', '*BROWN', '*NORTHWESTERN', '*VANDERBILT']",NA,"UMICH, BOSTON COLLEGE, FORDHAM","UPENN, WASHU","HARVARD, YALE, BROWN, NORTHWESTERN, VANDERBILT",3,2,5
M,WHITE,CA,Low,PUBLIC,LEGACY,ENG,1550,7.5,6.8,"['*UCLA', '*BERKELEY', '*UCSD', '*NORTHEASTERN']","['*HARVARD', '*CORNELL', '*UMICH', '*UCSB', '*UCI']","['*STANFORD', '*COLUMBIA', '*PRINCETON', '*JOHNS HOPKINS', '*DARTMOUTH', '*UPENN']",NA,"UCLA, BERKELEY, UCSD, NORTHEASTERN","HARVARD, CORNELL, UMICH, UCSB, UCI","STANFORD, COLUMBIA, PRINCETON, JOHNS HOPKINS, DARTMOUTH, UPENN",4,5,6
F,WHITE,CA,High,PUBLIC,NONE,ENG,1560,6.5,2.5,['*ARIZONA STATE'],"['*CORNELL', '*UCI']","['*BERKELEY', '*MIT', '*CALTECH']",NA,ARIZONA STATE,"CORNELL, UCI","BERKELEY, MIT, CALTECH",1,2,3
F,WHITE,NA,High,PUBLIC,LEGACY,POLISCI,1540,6.5,6.5,"['*SWARTHMORE', '*UNC CHAPEL HILL']",['*HARVARD'],"['*BROWN', '*PRINCETON', '*SWARTHMORE', '*UPENN']",NA,"SWARTHMORE, UNC CHAPEL HILL",HARVARD,"BROWN, PRINCETON, SWARTHMORE, UPENN",2,1,4
F,ASIAN,IN,Low,PRIVATE,LEGACY,POLISCI,1480,6.5,1.5,"['*UCSD', '*UCD']","['*UCLA', '*UMICH', '*BOSTON UNIVERSITY', '*UCI']","['*YALE', '*CORNELL', '*BERKELEY', '*NYU', '*USC', '*UCSB']",NA,"UCSD, UCD","UCLA, UMICH, BOSTON UNIVERSITY, UCI","YALE, CORNELL, BERKELEY, NYU, USC, UCSB",2,4,6
M,WHITE,NA,Low,PUBLIC,NONE,HUMANITIES,1540,5.5,6.1,"['*RICE', '*UIUC', '*BOSTON COLLEGE', '*ARIZONA STATE']",['*EMORY'],"['*HARVARD', '*YALE', '*BROWN', '*STANFORD', '*NORTHWESTERN', '*COLUMBIA', '*DUKE', '*PRINCETON', '*RICE']",NA,"RICE, UIUC, BOSTON COLLEGE, ARIZONA STATE",EMORY,"HARVARD, YALE, BROWN, STANFORD, NORTHWESTERN, COLUMBIA, DUKE, PRINCETON, RICE",4,1,9
F,ASIAN,IL,Low,PUBLIC,NONE,BIO,1440,5.5,6.5,"['*CORNELL', '*PURDUE', '*UMICH', '*USC', '*UIUC']",['*EMORY'],"['*NYU', '*WASHU', '*NORTHEASTERN']",NA,"CORNELL, PURDUE, UMICH, USC, UIUC",EMORY,"NYU, WASHU, NORTHEASTERN",5,1,3
F,ASIAN,NY,Low,PUBLIC,FIRST-GEN,HEALTH SCIENCES,1520,6,4.5,['*UMICH'],['*BOSTON COLLEGE'],"['*CORNELL', '*JOHNS HOPKINS', '*EMORY', '*CASE WESTERN', '*BOSTON UNIVERSITY', '*NORTHEASTERN', '*COLGATE', '*TUFTS']",NA,UMICH,BOSTON COLLEGE,"CORNELL, JOHNS HOPKINS, EMORY, CASE WESTERN, BOSTON UNIVERSITY, NORTHEASTERN, COLGATE, TUFTS",1,1,8
F,ASIAN,CO,Low,PUBLIC,NONE,NA,1550,6.5,4.5,"['*UCLA', '*CORNELL', '*NYU', '*UPENN', '*UIUC']","['*JOHNS HOPKINS', '*RICE', '*UMICH', '*UCHICAGO']","['*HARVARD', '*YALE', '*STANFORD', '*NORTHWESTERN', '*COLUMBIA', '*BERKELEY', '*DUKE', '*PRINCETON']",NA,"UCLA, CORNELL, NYU, UPENN, UIUC","JOHNS HOPKINS, RICE, UMICH, UCHICAGO","HARVARD, YALE, STANFORD, NORTHWESTERN, COLUMBIA, BERKELEY, DUKE, PRINCETON",5,4,8
F,HISPANIC,FL,Low,PUBLIC,URM,CS,1540,5.5,8.7,"['*GEORGIA TECH', '*JOHNS HOPKINS']","['*COLUMBIA', '*CORNELL', '*DUKE']","['*HARVARD', '*YALE', '*BROWN', '*STANFORD', '*PRINCETON', '*CALTECH', '*GEORGIA TECH', '*DARTMOUTH', '*CMU']",NA,"GEORGIA TECH, JOHNS HOPKINS","COLUMBIA, CORNELL, DUKE","HARVARD, YALE, BROWN, STANFORD, PRINCETON, CALTECH, GEORGIA TECH, DARTMOUTH, CMU",2,3,9
M,HISPANIC,TN,High,PUBLIC,NONE,PREMED,1480,6.5,6.8,"['*BERKELEY', '*CMU', '*UMICH', '*EMORY', '*CASE WESTERN', '*WASHU']","['*UCLA', '*CORNELL', '*DUKE', '*WILLIAMS', '*VANDERBILT', '*UVA']","['*YALE', '*BROWN', '*STANFORD', '*NORTHWESTERN', '*JOHNS HOPKINS', '*SWARTHMORE', '*RICE', '*UPENN']",NA,"BERKELEY, CMU, UMICH, EMORY, CASE WESTERN, WASHU","UCLA, CORNELL, DUKE, WILLIAMS, VANDERBILT, UVA","YALE, BROWN, STANFORD, NORTHWESTERN, JOHNS HOPKINS, SWARTHMORE, RICE, UPENN",6,6,8
M,BLACK,NA,Middle,NA,URM,CS,1510,7.5,2.5,"['*YALE', '*COLUMBIA', '*CORNELL', '*PRINCETON', '*CALTECH', '*SWARTHMORE', '*RICE', '*POMONA', '*WILLIAMS', '*NYU', '*UPENN', '*EMORY', '*BOSTON UNIVERSITY', '*BOSTON COLLEGE', '*UCHICAGO', '*CLAREMONT MCKENNA']",['*HARVARD'],['*STANFORD'],NA,"YALE, COLUMBIA, CORNELL, PRINCETON, CALTECH, SWARTHMORE, RICE, POMONA, WILLIAMS, NYU, UPENN, EMORY, BOSTON UNIVERSITY, BOSTON COLLEGE, UCHICAGO, CLAREMONT MCKENNA",HARVARD,STANFORD,16,1,1
F,WHITE,OR,Low,PUBLIC,NONE,ENG,1450,6.5,4.5,['*UPENN'],['*TUFTS'],"['*HARVARD', '*UPENN', '*TUFTS']",NA,UPENN,TUFTS,"HARVARD, UPENN, TUFTS",1,1,3
M,BLACK,CA,Low,PUBLIC,URM,CS,1490,8.5,4.5,"['*BROWN', '*COLUMBIA', '*CORNELL', '*DUKE', '*PRINCETON', '*GEORGIA TECH', '*DARTMOUTH', '*RICE', '*VANDERBILT', '*UPENN', '*UMICH']","['*HARVARD', '*YALE', '*CMU', '*UCHICAGO']","['*STANFORD', '*MIT', '*UNC CHAPEL HILL']",NA,"BROWN, COLUMBIA, CORNELL, DUKE, PRINCETON, GEORGIA TECH, DARTMOUTH, RICE, VANDERBILT, UPENN, UMICH","HARVARD, YALE, CMU, UCHICAGO","STANFORD, MIT, UNC CHAPEL HILL",11,4,3
F,HISPANIC,GA,Low,SMALL,FIRST-GEN,NEUROSCIENCE,1330,6.5,4.2,"['*NYU', '*EMORY', '*FORDHAM']","['*COLUMBIA', '*DUKE', '*COLGATE']","['*HARVARD', '*YALE', '*NORTHEASTERN']",NA,"NYU, EMORY, FORDHAM","COLUMBIA, DUKE, COLGATE","HARVARD, YALE, NORTHEASTERN",3,3,3
F,ASIAN,IL,High,PUBLIC,NONE,ENG,1560,6.5,3.5,"['*PURDUE', '*UIUC']","['*CORNELL', '*JOHNS HOPKINS', '*CMU', '*NORTHEASTERN']","['*UCLA', '*NORTHWESTERN', '*BERKELEY', '*MIT', '*UPENN', '*UIUC']",NA,"PURDUE, UIUC","CORNELL, JOHNS HOPKINS, CMU, NORTHEASTERN","UCLA, NORTHWESTERN, BERKELEY, MIT, UPENN, UIUC",2,4,6
M,ASIAN,MA,High,PRIVATE,NONE,ENG,1540,3.5,4.5,"['*BOSTON UNIVERSITY', '*BOSTON COLLEGE', '*NORTHEASTERN', '*TUFTS']","['*HARVARD', '*BROWN', '*CORNELL', '*UMICH']","['*YALE', '*MIT', '*CMU']",NA,"BOSTON UNIVERSITY, BOSTON COLLEGE, NORTHEASTERN, TUFTS","HARVARD, BROWN, CORNELL, UMICH","YALE, MIT, CMU",4,4,3
F,ASIAN,CO,Low,PUBLIC,NONE,BIO,1530,6.5,4.5,"['*COLUMBIA', '*USC']",['*RICE'],"['*YALE', '*CORNELL']",NA,"COLUMBIA, USC",RICE,"YALE, CORNELL",2,1,2
F,ASIAN,MI,Low,PUBLIC,NONE,CS,1550,6.5,7.3,['*UT-DALLAS'],"['*NYU', '*WASHU', '*UVA']","['*YALE', '*BROWN', '*COLUMBIA', '*PRINCETON', '*SWARTHMORE', '*CMU', '*TUFTS']",NA,UT-DALLAS,"NYU, WASHU, UVA","YALE, BROWN, COLUMBIA, PRINCETON, SWARTHMORE, CMU, TUFTS",1,3,7
F,ASIAN,IN,Low,PUBLIC,NONE,ENG,1540,6.5,6.5,"['*PURDUE', '*UIUC', '*RUTGERS', '*UNC CHAPEL HILL']",['*VANDERBILT'],"['*BROWN', '*NORTHWESTERN', '*BOSTON UNIVERSITY', '*WASHU']",NA,"PURDUE, UIUC, RUTGERS, UNC CHAPEL HILL",VANDERBILT,"BROWN, NORTHWESTERN, BOSTON UNIVERSITY, WASHU",4,1,4
M,ASIAN,CA,Low,NA,LEGACY,ENG,1590,5.5,1.5,"['*UCSD', '*POMONA', '*UCD', '*UIUC', '*UT-AUSTIN', '*VIRGINIA TECH', '*UVA', '*UCM']","['*CORNELL', '*PURDUE', '*UMICH', '*UCI']","['*UCLA', '*COLUMBIA', '*GEORGIA TECH', '*UPENN']",NA,"UCSD, POMONA, UCD, UIUC, UT-AUSTIN, VIRGINIA TECH, UVA, UCM","CORNELL, PURDUE, UMICH, UCI","UCLA, COLUMBIA, GEORGIA TECH, UPENN",8,4,4
M,WHITE,CO,NA,PUBLIC,NONE,CHEMISTRY,1540,7.5,7.5,"['*VANDERBILT', '*UVA']",[],"['*DUKE', '*DARTMOUTH', '*EMORY']",NA,"VANDERBILT, UVA",,"DUKE, DARTMOUTH, EMORY",2,0,3
F,WHITE,NY,Low,PRIVATE,LEGACY,ENG,1530,3,7.5,"['*CORNELL', '*UPENN', '*UMICH', '*BOSTON UNIVERSITY']","['*BROWN', '*WILLIAMS']","['*YALE', '*POMONA', '*CASE WESTERN', '*NORTHEASTERN', '*COLGATE']",NA,"CORNELL, UPENN, UMICH, BOSTON UNIVERSITY","BROWN, WILLIAMS","YALE, POMONA, CASE WESTERN, NORTHEASTERN, COLGATE",4,2,5
F,ASIAN,USA,Low,PUBLIC,NONE,ENVIRONMENTAL STUDIES,1480,3,4.5,"['*CORNELL', '*USC']","['*COLUMBIA', '*UPENN', '*BOSTON UNIVERSITY']","['*YALE', '*BROWN', '*COLUMBIA', '*CORNELL', '*DUKE', '*RICE', '*UPENN', '*WASHU']",NA,"CORNELL, USC","COLUMBIA, UPENN, BOSTON UNIVERSITY","YALE, BROWN, COLUMBIA, CORNELL, DUKE, RICE, UPENN, WASHU",2,3,8
T,ASIAN,GA,High,PUBLIC,URM,PREMED,1580,7.5,8.5,"['*HARVARD', '*BROWN', '*STANFORD', '*DUKE', '*PRINCETON', '*GEORGIA TECH', '*UPENN', '*EMORY', '*NORTHEASTERN', '*UCHICAGO']","['*PRINCETON', '*MIT']","['*HARVARD', '*JOHNS HOPKINS', '*UCHICAGO']",NA,"HARVARD, BROWN, STANFORD, DUKE, PRINCETON, GEORGIA TECH, UPENN, EMORY, NORTHEASTERN, UCHICAGO","PRINCETON, MIT","HARVARD, JOHNS HOPKINS, UCHICAGO",10,2,3
M,WHITE,CA,Low,NA,NONE,ENG,1480,6.5,6.5,"['*PURDUE', '*San Jose State University', '*NORTHEASTERN', '*UCI']","['*UCLA', '*CMU', '*NYU', '*UMICH', '*UIUC']","['*STANFORD', '*NORTHWESTERN', '*COLUMBIA', '*CORNELL', '*PRINCETON', '*CALTECH', '*GEORGIA TECH']",NA,"PURDUE, San Jose State University, NORTHEASTERN, UCI","UCLA, CMU, NYU, UMICH, UIUC","STANFORD, NORTHWESTERN, COLUMBIA, CORNELL, PRINCETON, CALTECH, GEORGIA TECH",4,5,7
F,ASIAN,IN,Low,NA,FIRST-GEN,CS,1590,8.5,3.5,"['*CORNELL', '*DARTMOUTH', '*RICE', '*WILLIAMS']","['*COLUMBIA', '*UPENN']","['*HARVARD', '*YALE', '*STANFORD', '*NORTHWESTERN', '*DUKE']",NA,"CORNELL, DARTMOUTH, RICE, WILLIAMS","COLUMBIA, UPENN","HARVARD, YALE, STANFORD, NORTHWESTERN, DUKE",4,2,5
M,ASIAN,OR,Low,PUBLIC,NONE,BIO,1590,8.5,8.5,"['*UCLA', '*BERKELEY', '*PRINCETON', '*UMICH', '*WASHU', '*RUTGERS', '*UNC CHAPEL HILL']","['*BROWN', '*DUKE', '*DARTMOUTH', '*RICE', '*VANDERBILT', '*UPENN']","['*HARVARD', '*YALE', '*NORTHWESTERN', '*COLUMBIA', '*CORNELL', '*JOHNS HOPKINS', '*UCHICAGO']",NA,"UCLA, BERKELEY, PRINCETON, UMICH, WASHU, RUTGERS, UNC CHAPEL HILL","BROWN, DUKE, DARTMOUTH, RICE, VANDERBILT, UPENN","HARVARD, YALE, NORTHWESTERN, COLUMBIA, CORNELL, JOHNS HOPKINS, UCHICAGO",7,6,7
M,WHITE,OR,Low,NA,NONE,CS,1560,2.5,4.5,['*USC'],[],"['*HARVARD', '*YALE', '*PRINCETON']",NA,USC,,"HARVARD, YALE, PRINCETON",1,0,3
M,ASIAN,UT,Low,NA,NONE,DESIGN,1490,8.5,3.7,[],['*COLUMBIA'],"['*UCLA', '*BROWN', '*STANFORD', '*CORNELL', '*BERKELEY', '*UPENN', '*UMICH', '*UCHICAGO']",NA,,COLUMBIA,"UCLA, BROWN, STANFORD, CORNELL, BERKELEY, UPENN, UMICH, UCHICAGO",0,1,8
NB,ASIAN,CO,Low,PUBLIC,FIRST-GEN,CS,1320,5.5,8.5,"['*RUTGERS', '*VIRGINIA TECH', '*UVA']","['*PURDUE', '*UPENN']","['*PURDUE', '*BOSTON UNIVERSITY', '*NORTHEASTERN']",NA,"RUTGERS, VIRGINIA TECH, UVA","PURDUE, UPENN","PURDUE, BOSTON UNIVERSITY, NORTHEASTERN",3,2,3
M,ASIAN,UT,Low,INTERNATIONAL,NONE,CS,1560,7.5,6.5,['*CORNELL'],"['*UCLA', '*CORNELL', '*BERKELEY', '*UCHICAGO']","['*YALE', '*STANFORD', '*PRINCETON', '*MIT', '*CALTECH', '*JOHNS HOPKINS', '*UPENN']",NA,CORNELL,"UCLA, CORNELL, BERKELEY, UCHICAGO","YALE, STANFORD, PRINCETON, MIT, CALTECH, JOHNS HOPKINS, UPENN",1,4,7
F,WHITE,NY,Low,PUBLIC,LEGACY,HISTORY,1330,3.5,6.5,['*BOSTON UNIVERSITY'],[],['*NYU'],NA,BOSTON UNIVERSITY,,NYU,1,0,1
T,ASIAN,NE,Low,PUBLIC,NONE,CS,1480,6.5,7.5,"['*UCLA', '*BERKELEY', '*UCSD', '*CMU', '*RICE', '*UCSB', '*UCSC']","['*HARVARD', '*SWARTHMORE', '*UCI']","['*COLUMBIA', '*PRINCETON', '*MIT']",NA,"UCLA, BERKELEY, UCSD, CMU, RICE, UCSB, UCSC","HARVARD, SWARTHMORE, UCI","COLUMBIA, PRINCETON, MIT",7,3,3
F,ASIAN,TX,Low,PUBLIC,NONE,CS,1520,6.5,4.5,"['*HARVARD', '*STANFORD', '*MIT', '*RICE', '*UT-AUSTIN']","['*COLUMBIA', '*CASE WESTERN', '*NORTHEASTERN']","['*YALE', '*MIT']",NA,"HARVARD, STANFORD, MIT, RICE, UT-AUSTIN","COLUMBIA, CASE WESTERN, NORTHEASTERN","YALE, MIT",5,3,2
F,WHITE,USA,Middle,PUBLIC,NONE,CS,1590,9.5,8.5,[],"['*UMICH', '*NORTHEASTERN']","['*HARVARD', '*YALE', '*COLUMBIA', '*CORNELL', '*PRINCETON', '*MIT', '*VANDERBILT', '*UPENN', '*EMORY', '*BOSTON UNIVERSITY', '*COLGATE']",NA,,"UMICH, NORTHEASTERN","HARVARD, YALE, COLUMBIA, CORNELL, PRINCETON, MIT, VANDERBILT, UPENN, EMORY, BOSTON UNIVERSITY, COLGATE",0,2,11
M,NATIVE,MA,Low,PRIVATE,NONE,CS,1240,5,7.8,"['*YALE', '*CORNELL', '*DARTMOUTH', '*CMU', '*UIUC']","['*BERKELEY', '*PRINCETON', '*MIT', '*UMICH']","['*UCLA', '*YALE', '*COLUMBIA', '*CALTECH', '*UT-AUSTIN']",NA,"YALE, CORNELL, DARTMOUTH, CMU, UIUC","BERKELEY, PRINCETON, MIT, UMICH","UCLA, YALE, COLUMBIA, CALTECH, UT-AUSTIN",5,4,5
F,WHITE,MI,High,PUBLIC,NONE,POLISCI,1490,8.5,6.5,"['*NORTHWESTERN', '*UCSD', '*BOSTON COLLEGE', '*FORDHAM', '*NORTHEASTERN']","['*COLUMBIA', '*BERKELEY', '*UPENN', '*BOSTON UNIVERSITY']","['*HARVARD', '*YALE', '*BROWN', '*PRINCETON', '*NYU']",NA,"NORTHWESTERN, UCSD, BOSTON COLLEGE, FORDHAM, NORTHEASTERN","COLUMBIA, BERKELEY, UPENN, BOSTON UNIVERSITY","HARVARD, YALE, BROWN, PRINCETON, NYU",5,4,5
M,WHITE,MA,NA,NA,NONE,CS,1550,0,4.5,[],[],"['*HARVARD', '*YALE', '*BROWN', '*STANFORD', '*COLUMBIA', '*CORNELL', '*DUKE', '*PRINCETON', '*DARTMOUTH', '*UPENN']",NA,,,"HARVARD, YALE, BROWN, STANFORD, COLUMBIA, CORNELL, DUKE, PRINCETON, DARTMOUTH, UPENN",0,0,10
F,ASIAN,GA,High,PUBLIC,NONE,ENG,1580,6.5,3.7,['*UPENN'],"['*DUKE', '*CMU', '*NORTHEASTERN']","['*STANFORD', '*NORTHWESTERN', '*PRINCETON', '*MIT']",NA,UPENN,"DUKE, CMU, NORTHEASTERN","STANFORD, NORTHWESTERN, PRINCETON, MIT",1,3,4
M,ASIAN,TX,Low,PUBLIC,NONE,BIO,1570,7.5,7.7,"['*RICE', '*UT-AUSTIN', '*TAMU']",['*WASHU'],"['*HARVARD', '*STANFORD', '*RICE', '*UCHICAGO']",NA,"RICE, UT-AUSTIN, TAMU",WASHU,"HARVARD, STANFORD, RICE, UCHICAGO",3,1,4
M,WHITE,MA,Low,NA,NONE,ENVIRONMENTAL STUDIES,1500,6.5,6.5,"['*WILLIAMS', '*BOSTON UNIVERSITY', '*FORDHAM', '*NORTHEASTERN']",[],"['*BROWN', '*STANFORD']",NA,"WILLIAMS, BOSTON UNIVERSITY, FORDHAM, NORTHEASTERN",,"BROWN, STANFORD",4,0,2
M,WHITE,IN,Low,NA,NONE,HUMANITIES,1450,3.5,9.5,[],"['*VIRGINIA TECH', '*UVA']","['*STANFORD', '*COLUMBIA', '*NYU', '*USC']",NA,,"VIRGINIA TECH, UVA","STANFORD, COLUMBIA, NYU, USC",0,2,4
M,NATIVE,CO,Low,PUBLIC,FIRST-GEN,BIO,1430,8.5,6.5,"['*BROWN', '*STANFORD', '*NORTHWESTERN', '*COLUMBIA', '*DARTMOUTH', '*CASE WESTERN']",['*UCHICAGO'],['*MIT'],NA,"BROWN, STANFORD, NORTHWESTERN, COLUMBIA, DARTMOUTH, CASE WESTERN",UCHICAGO,MIT,6,1,1
M,ASIAN,NA,Low,PUBLIC,NONE,ENG,1520,7.5,4.2,"['*GEORGIA TECH', '*USC', '*WASHU', '*UVA']","['*UCLA', '*HARVARD', '*BROWN', '*COLUMBIA', '*DUKE', '*DARTMOUTH', '*RICE', '*VANDERBILT', '*UPENN', '*UMICH']","['*YALE', '*STANFORD', '*NORTHWESTERN', '*CORNELL', '*BERKELEY', '*PRINCETON']",NA,"GEORGIA TECH, USC, WASHU, UVA","UCLA, HARVARD, BROWN, COLUMBIA, DUKE, DARTMOUTH, RICE, VANDERBILT, UPENN, UMICH","YALE, STANFORD, NORTHWESTERN, CORNELL, BERKELEY, PRINCETON",4,10,6
F,ASIAN,NE,High,PUBLIC,LEGACY,ENVIRONMENTAL STUDIES,1470,5,8.1,['*RUTGERS'],['*WILLIAMS'],"['*YALE', '*BROWN']",NA,RUTGERS,WILLIAMS,"YALE, BROWN",1,1,2
M,BLACK,NY,Low,PRIVATE,NONE,BIO,1410,3.5,2.5,"['*CORNELL', '*DUKE', '*JOHNS HOPKINS', '*EMORY', '*CASE WESTERN', '*USC', '*BOSTON UNIVERSITY', '*FORDHAM', '*TUFTS', '*CLAREMONT MCKENNA']",['*NYU'],['*NORTHEASTERN'],NA,"CORNELL, DUKE, JOHNS HOPKINS, EMORY, CASE WESTERN, USC, BOSTON UNIVERSITY, FORDHAM, TUFTS, CLAREMONT MCKENNA",NYU,NORTHEASTERN,10,1,1
M,WHITE,FL,High,PUBLIC,LEGACY,CS,1520,7.5,6.8,[],"['*DUKE', '*UCHICAGO', '*UVA']","['*HARVARD', '*YALE', '*STANFORD', '*COLUMBIA', '*PRINCETON']",NA,,"DUKE, UCHICAGO, UVA","HARVARD, YALE, STANFORD, COLUMBIA, PRINCETON",0,3,5
F,WHITE,OR,NA,PUBLIC,LEGACY,CS,1510,6.5,0,['*NORTHEASTERN'],[],"['*YALE', '*BROWN', '*STANFORD', '*SWARTHMORE', '*UPENN']",NA,NORTHEASTERN,,"YALE, BROWN, STANFORD, SWARTHMORE, UPENN",1,0,5
T,WHITE,PA,Low,PUBLIC,FIRST-GEN,CS,1550,5,4.5,"['*STANFORD', '*UPENN', '*NORTHEASTERN']","['*UCLA', '*HARVEY MUDD']","['*HARVARD', '*BROWN', '*COLUMBIA', '*CMU', '*BOSTON UNIVERSITY']",NA,"STANFORD, UPENN, NORTHEASTERN","UCLA, HARVEY MUDD","HARVARD, BROWN, COLUMBIA, CMU, BOSTON UNIVERSITY",3,2,5
F,BLACK,GA,Middle,PUBLIC,URM,CS,1500,7.5,4.5,"['*BROWN', '*STANFORD', '*COLUMBIA', '*DUKE', '*GEORGIA TECH', '*VANDERBILT', '*UPENN', '*USC', '*UCHICAGO', '*UNC CHAPEL HILL']",[],"['*HARVARD', '*YALE', '*MIT']",NA,"BROWN, STANFORD, COLUMBIA, DUKE, GEORGIA TECH, VANDERBILT, UPENN, USC, UCHICAGO, UNC CHAPEL HILL",,"HARVARD, YALE, MIT",10,0,3
F,WHITE,CO,Low,PUBLIC,NONE,CS,1520,3.5,7.5,['*HARVARD'],"['*CORNELL', '*UMICH']","['*HARVARD', '*YALE', '*PRINCETON', '*MIT']",NA,HARVARD,"CORNELL, UMICH","HARVARD, YALE, PRINCETON, MIT",1,2,4
M,ASIAN,OR,Low,PUBLIC,NONE,ENG,1590,8.5,4.5,"['*YALE', '*BROWN', '*COLUMBIA', '*DUKE', '*PRINCETON', '*GEORGIA TECH', '*RICE', '*UMICH', '*USC']",['*HARVARD'],"['*STANFORD', '*CORNELL', '*MIT', '*DARTMOUTH', '*CMU', '*UPENN', '*CASE WESTERN']",NA,"YALE, BROWN, COLUMBIA, DUKE, PRINCETON, GEORGIA TECH, RICE, UMICH, USC",HARVARD,"STANFORD, CORNELL, MIT, DARTMOUTH, CMU, UPENN, CASE WESTERN",9,1,7
M,ASIAN,CA,Low,PUBLIC,NONE,HEALTH SCIENCES,1500,6.5,6.5,"['*UPENN', '*EMORY', '*CASE WESTERN', '*BOSTON COLLEGE', '*NORTHEASTERN', '*ARIZONA STATE']","['*UMICH', '*UCI']","['*UCLA', '*BERKELEY', '*UCSD', '*UNC CHAPEL HILL']",NA,"UPENN, EMORY, CASE WESTERN, BOSTON COLLEGE, NORTHEASTERN, ARIZONA STATE","UMICH, UCI","UCLA, BERKELEY, UCSD, UNC CHAPEL HILL",6,2,4
M,ASIAN,UT,Low,NA,NONE,CS,1430,8.5,8.5,"['*BROWN', '*NORTHWESTERN', '*CORNELL']",['*YALE'],['*HARVARD'],NA,"BROWN, NORTHWESTERN, CORNELL",YALE,HARVARD,3,1,1
F,BLACK,GA,High,PUBLIC,URM,CS,1400,7.5,4.5,"['*NORTHWESTERN', '*GEORGIA TECH', '*WILLIAMS', '*VANDERBILT', '*TUFTS']",[],[],NA,"NORTHWESTERN, GEORGIA TECH, WILLIAMS, VANDERBILT, TUFTS",,,5,0,0
F,ASIAN,NY,Low,PUBLIC,NONE,PREMED,1580,6.5,7.9,['*CMU'],[],"['*CORNELL', '*MIT', '*NYU']",NA,CMU,,"CORNELL, MIT, NYU",1,0,3
F,WHITE,NY,Low,PRIVATE,NONE,NA,1320,6.5,9.5,"['*CORNELL', '*COLGATE', '*UCHICAGO']","['*COLUMBIA', '*CMU']","['*YALE', '*BROWN']",NA,"CORNELL, COLGATE, UCHICAGO","COLUMBIA, CMU","YALE, BROWN",3,2,2
M,ASIAN,OR,High,PUBLIC,NONE,ENG,1530,6.5,7.5,['*PURDUE'],"['*GEORGIA TECH', '*TULANE']","['*HARVARD', '*BROWN', '*STANFORD', '*CORNELL', '*MIT', '*CALTECH', '*DARTMOUTH', '*RICE', '*WASHU', '*NORTHEASTERN']",NA,PURDUE,"GEORGIA TECH, TULANE","HARVARD, BROWN, STANFORD, CORNELL, MIT, CALTECH, DARTMOUTH, RICE, WASHU, NORTHEASTERN",1,2,10
M,ASIAN,NY,Low,PUBLIC,NONE,CS,1400,2.5,6.8,"['*PURDUE', '*UMICH']",[],"['*CORNELL', '*MIT', '*CMU']",NA,"PURDUE, UMICH",,"CORNELL, MIT, CMU",2,0,3
M,ASIAN,CO,Low,PUBLIC,NONE,ENG,1510,5.5,7.5,"['*CORNELL', '*USC', '*UT-AUSTIN']","['*UCSD', '*PURDUE', '*UIUC', '*NORTHEASTERN']","['*UCLA', '*STANFORD', '*COLUMBIA', '*GEORGIA TECH', '*WASHU', '*TULANE']",NA,"CORNELL, USC, UT-AUSTIN","UCSD, PURDUE, UIUC, NORTHEASTERN","UCLA, STANFORD, COLUMBIA, GEORGIA TECH, WASHU, TULANE",3,4,6
F,ASIAN,PA,Low,PUBLIC,LEGACY,ENG,1550,7.5,4.5,"['*UCSD', '*GEORGIA TECH', '*CMU', '*UPENN', '*UCD', '*UIUC', '*VIRGINIA TECH', '*UVA']","['*DUKE', '*EMORY']","['*UCLA', '*PRINCETON', '*USC', '*UT-AUSTIN']",NA,"UCSD, GEORGIA TECH, CMU, UPENN, UCD, UIUC, VIRGINIA TECH, UVA","DUKE, EMORY","UCLA, PRINCETON, USC, UT-AUSTIN",8,2,4
F,ASIAN,UT,Low,PUBLIC,NONE,SOCIAL SCIENCES,1420,7.5,6.8,"['*HARVARD', '*UT-DALLAS', '*FORDHAM']",[],"['*COLUMBIA', '*RICE', '*WILLIAMS', '*TUFTS']",NA,"HARVARD, UT-DALLAS, FORDHAM",,"COLUMBIA, RICE, WILLIAMS, TUFTS",3,0,4
F,WHITE,NY,Middle,PRIVATE,NONE,CS,1470,6.5,6.2,"['*CORNELL', '*EMORY']",['*BOSTON UNIVERSITY'],"['*HARVARD', '*YALE', '*COLUMBIA', '*PRINCETON', '*NYU', '*UPENN']",NA,"CORNELL, EMORY",BOSTON UNIVERSITY,"HARVARD, YALE, COLUMBIA, PRINCETON, NYU, UPENN",2,1,6
M,WHITE,VA,High,PUBLIC,LEGACY,HUMANITIES,1400,3,6.7,"['*USC', '*UVA']",['*BOSTON COLLEGE'],"['*BROWN', '*NORTHWESTERN', '*DARTMOUTH', '*UPENN']",NA,"USC, UVA",BOSTON COLLEGE,"BROWN, NORTHWESTERN, DARTMOUTH, UPENN",2,1,4
F,ASIAN,WA,Low,PUBLIC,NONE,HUMANITIES,1530,5.5,4.2,"['*NYU', '*UCR', '*FORDHAM']","['*UCLA', '*POMONA', '*EMORY']","['*BROWN', '*NORTHWESTERN', '*COLUMBIA', '*WILLIAMS', '*UMICH', '*UCHICAGO']",NA,"NYU, UCR, FORDHAM","UCLA, POMONA, EMORY","BROWN, NORTHWESTERN, COLUMBIA, WILLIAMS, UMICH, UCHICAGO",3,3,6
F,ASIAN,OR,Low,PUBLIC,NONE,BIO,1570,6.5,4.5,"['*HARVARD', '*YALE', '*BERKELEY', '*RICE', '*UMICH', '*UNC CHAPEL HILL']","['*BROWN', '*STANFORD', '*CORNELL', '*UCHICAGO']","['*UPENN', '*WASHU', '*TUFTS']",NA,"HARVARD, YALE, BERKELEY, RICE, UMICH, UNC CHAPEL HILL","BROWN, STANFORD, CORNELL, UCHICAGO","UPENN, WASHU, TUFTS",6,4,3
M,WHITE,NA,Low,NA,NONE,CS,1590,5.5,3.5,"['*BROWN', '*DUKE', '*GEORGIA TECH', '*DARTMOUTH', '*WASHU', '*UVA']","['*YALE', '*CMU', '*VANDERBILT', '*NORTHEASTERN', '*TUFTS']","['*HARVARD', '*STANFORD', '*PRINCETON', '*CALTECH']",NA,"BROWN, DUKE, GEORGIA TECH, DARTMOUTH, WASHU, UVA","YALE, CMU, VANDERBILT, NORTHEASTERN, TUFTS","HARVARD, STANFORD, PRINCETON, CALTECH",6,5,4
F,WHITE,IL,Low,PUBLIC,NONE,ENG,1530,7.5,6.5,"['*PRINCETON', '*GEORGIA TECH', '*UCD', '*UIUC', '*UCI']","['*UCLA', '*BROWN', '*NORTHWESTERN', '*CORNELL', '*BERKELEY', '*CALTECH', '*VANDERBILT', '*UMICH', '*UNC CHAPEL HILL']","['*HARVARD', '*YALE', '*STANFORD', '*DUKE', '*MIT', '*DARTMOUTH', '*CMU']",NA,"PRINCETON, GEORGIA TECH, UCD, UIUC, UCI","UCLA, BROWN, NORTHWESTERN, CORNELL, BERKELEY, CALTECH, VANDERBILT, UMICH, UNC CHAPEL HILL","HARVARD, YALE, STANFORD, DUKE, MIT, DARTMOUTH, CMU",5,9,7
F,ASIAN,OR,High,PUBLIC,NONE,CS,1550,5.5,4.5,"['*CORNELL', '*MIT', '*VANDERBILT', '*UPENN', '*NORTHEASTERN']","['*HARVARD', '*COLUMBIA', '*JOHNS HOPKINS', '*CMU', '*NYU']","['*BROWN', '*PRINCETON']",NA,"CORNELL, MIT, VANDERBILT, UPENN, NORTHEASTERN","HARVARD, COLUMBIA, JOHNS HOPKINS, CMU, NYU","BROWN, PRINCETON",5,5,2
M,WHITE,CA,High,PRIVATE,URM,POLISCI,1550,7.5,7.5,['*PRINCETON'],"['*UCLA', '*HARVARD', '*YALE', '*BERKELEY']","['*STANFORD', '*PRINCETON', '*UCI']",NA,PRINCETON,"UCLA, HARVARD, YALE, BERKELEY","STANFORD, PRINCETON, UCI",1,4,3
M,ASIAN,CA,Middle,PUBLIC,NONE,CHEMISTRY,1550,6,2.5,"['*UCLA', '*UCD', '*UCR']","['*UCSD', '*UCSB', '*UCI']","['*UCLA', '*YALE', '*BROWN', '*STANFORD', '*NORTHWESTERN', '*CORNELL', '*DUKE', '*VANDERBILT', '*UPENN']",NA,"UCLA, UCD, UCR","UCSD, UCSB, UCI","UCLA, YALE, BROWN, STANFORD, NORTHWESTERN, CORNELL, DUKE, VANDERBILT, UPENN",3,3,9
M,WHITE,OR,Low,PUBLIC,NONE,CS,1500,8.5,7.5,"['*YALE', '*PRINCETON', '*UPENN']","['*HARVARD', '*COLUMBIA', '*DARTMOUTH', '*UCHICAGO']","['*STANFORD', '*CORNELL', '*DUKE', '*MIT', '*JOHNS HOPKINS']",NA,"YALE, PRINCETON, UPENN","HARVARD, COLUMBIA, DARTMOUTH, UCHICAGO","STANFORD, CORNELL, DUKE, MIT, JOHNS HOPKINS",3,4,5
F,ASIAN,UT,Middle,INTERNATIONAL,NONE,CS,1590,6.5,4.5,"['*CORNELL', '*UCSD', '*UIUC']","['*CMU', '*UMICH']","['*UCLA', '*HARVARD', '*STANFORD', '*CORNELL', '*BERKELEY', '*PRINCETON', '*MIT', '*CALTECH']",NA,"CORNELL, UCSD, UIUC","CMU, UMICH","UCLA, HARVARD, STANFORD, CORNELL, BERKELEY, PRINCETON, MIT, CALTECH",3,2,8
F,NA,NA,Low,NA,URM,CS,1500,6.5,1,"['*HARVARD', '*YALE', '*BROWN', '*NORTHWESTERN', '*DUKE', '*PRINCETON', '*MIT', '*UMICH', '*UCHICAGO']",[],"['*STANFORD', '*NORTHEASTERN', '*UVA']",NA,"HARVARD, YALE, BROWN, NORTHWESTERN, DUKE, PRINCETON, MIT, UMICH, UCHICAGO",,"STANFORD, NORTHEASTERN, UVA",9,0,3
M,ASIAN,IN,Low,PRIVATE,NONE,CS,1520,6.5,4.5,"['*GEORGIA TECH', '*PURDUE', '*UPENN', '*CASE WESTERN', '*USC', '*UIUC', '*NORTHEASTERN']","['*UPENN', '*UMICH']","['*HARVARD', '*CORNELL', '*PRINCETON', '*GEORGIA TECH', '*UMICH', '*USC', '*UIUC', '*WASHU']",NA,"GEORGIA TECH, PURDUE, UPENN, CASE WESTERN, USC, UIUC, NORTHEASTERN","UPENN, UMICH","HARVARD, CORNELL, PRINCETON, GEORGIA TECH, UMICH, USC, UIUC, WASHU",7,2,8
F,ASIAN,NY,Low,MAGNET,FIRST-GEN,POLISCI,1570,7.5,8.5,"['*MIT', '*WILLIAMS', '*FORDHAM']","['*YALE', '*CORNELL', '*WILLIAMS', '*NYU', '*UPENN']","['*HARVARD', '*BROWN', '*COLUMBIA', '*PRINCETON', '*MIT', '*NORTHEASTERN']",NA,"MIT, WILLIAMS, FORDHAM","YALE, CORNELL, WILLIAMS, NYU, UPENN","HARVARD, BROWN, COLUMBIA, PRINCETON, MIT, NORTHEASTERN",3,5,6
M,WHITE,VA,Low,PUBLIC,NONE,ENVIRONMENTAL STUDIES,1380,5.5,4.5,"['*UCD', '*UCSC', '*VIRGINIA TECH', '*UVA']","['*CORNELL', '*UMICH']","['*CORNELL', '*BERKELEY', '*UMICH']",NA,"UCD, UCSC, VIRGINIA TECH, UVA","CORNELL, UMICH","CORNELL, BERKELEY, UMICH",4,2,3
M,BLACK,TX,Low,PUBLIC,NONE,ENG,1350,6.5,8.5,['*UPENN'],"['*RICE', '*UMICH']","['*HARVARD', '*YALE', '*BROWN', '*STANFORD', '*COLUMBIA', '*CORNELL', '*DUKE', '*PRINCETON', '*MIT', '*DARTMOUTH', '*UPENN']",NA,UPENN,"RICE, UMICH","HARVARD, YALE, BROWN, STANFORD, COLUMBIA, CORNELL, DUKE, PRINCETON, MIT, DARTMOUTH, UPENN",1,2,11
F,ASIAN,NA,High,PUBLIC,LEGACY,CS,1590,6.5,4.5,"['*SWARTHMORE', '*POMONA']","['*BROWN', '*PRINCETON', '*UPENN']",['*YALE'],NA,"SWARTHMORE, POMONA","BROWN, PRINCETON, UPENN",YALE,2,3,1
F,WHITE,AL,Low,PRIVATE,FIRST-GEN,CS,1430,3,4.5,"['*COLUMBIA', '*BOSTON UNIVERSITY']",[],"['*BROWN', '*NORTHEASTERN']",NA,"COLUMBIA, BOSTON UNIVERSITY",,"BROWN, NORTHEASTERN",2,0,2
M,WHITE,NA,High,NA,NONE,ENG,1430,5,6.5,"['*UCLA', '*UT-AUSTIN', '*NORTHEASTERN']","['*WILLIAMS', '*TULANE']","['*COLUMBIA', '*BERKELEY', '*DUKE', '*DARTMOUTH']",NA,"UCLA, UT-AUSTIN, NORTHEASTERN","WILLIAMS, TULANE","COLUMBIA, BERKELEY, DUKE, DARTMOUTH",3,2,4
