gender,race,residence,income,school_type,hooks,major,sat,ec_awards,essay_lor_interview,acceptances,waitlists,rejections,note,acceptances_clean,waitlists_clean,rejections_clean,num_acceptances,num_waitlists,num_rejections
M,ASIAN,MI,Low,NA,NONE,CS,1440,2,4.5,['*PURDUE'],"['*GEORGIA TECH', '*UMICH']","['*UIUC', '*NORTHEASTERN']",NA,PURDUE,"GEORGIA TECH, UMICH","UIUC, NORTHEASTERN",1,2,2
OTHER,ASIAN,IN,High,NA,NONE,CS,1390,5.5,4.5,['*STANFORD'],[],['*CALTECH'],NA,STANFORD,,CALTECH,1,0,1
F,ASIAN,MA,High,PUBLIC,NONE,NEUROSCIENCE,1580,7.5,7.5,"['*UCLA', '*HARVARD', '*YALE', '*COLUMBIA', '*DUKE', '*NYU', '*UMICH', '*UNC CHAPEL HILL', '*UVA']",['*UPENN'],"['*STANFORD', '*COLUMBIA']",NA,"UCLA, HARVARD, YALE, COLUMBIA, DUKE, NYU, UMICH, UNC CHAPEL HILL, UVA",UPENN,"STANFORD, COLUMBIA",9,1,2
M,WHITE,IN,Low,NA,URM,CS,1580,5.5,1.5,"['*GEORGIA TECH', '*UT-AUSTIN', '*ARIZONA STATE', '*UCI']","['*HARVARD', '*UCHICAGO']","['*UCLA', '*NORTHWESTERN', '*UMICH', '*EMORY', '*USC', '*HARVEY MUDD', '*UNC CHAPEL HILL', '*UVA']",NA,"GEORGIA TECH, UT-AUSTIN, ARIZONA STATE, UCI","HARVARD, UCHICAGO","UCLA, NORTHWESTERN, UMICH, EMORY, USC, HARVEY MUDD, UNC CHAPEL HILL, UVA",4,2,8
F,ASIAN,OR,Middle,PUBLIC,NONE,CS,1580,7.5,4.7,"['*CORNELL', '*RUTGERS']",[],['*CORNELL'],NA,"CORNELL, RUTGERS",,CORNELL,2,0,1
F,WHITE,NY,Low,PUBLIC,NONE,CS,1550,8.5,8,['*MIT'],[],[],NA,MIT,,,1,0,0
M,ASIAN,GA,Middle,PUBLIC,NONE,NA,1580,6.5,6.3,['*CMU'],[],"['*STANFORD', '*BERKELEY', '*GEORGIA TECH', '*PURDUE', '*UMICH']",NA,CMU,,"STANFORD, BERKELEY, GEORGIA TECH, PURDUE, UMICH",1,0,5
F,BLACK,TX,Middle,PUBLIC,URM,ENG,1520,3,2.5,"['*COLUMBIA', '*MIT', '*UT-AUSTIN', '*TAMU']",[],[],NA,"COLUMBIA, MIT, UT-AUSTIN, TAMU",,,4,0,0
T,ASIAN,CA,Low,PUBLIC,NONE,CS,1560,6.5,7.2,"['*BERKELEY', '*MIT', '*CALTECH']",[],[],NA,"BERKELEY, MIT, CALTECH",,,3,0,0
M,WHITE,IN,Low,PUBLIC,LEGACY,CS,1530,7.5,2.5,"['*BROWN', '*GEORGIA TECH', '*PURDUE', '*VIRGINIA TECH', '*UVA']","['*DUKE', '*UMICH', '*WASHU']","['*STANFORD', '*NORTHWESTERN']",NA,"BROWN, GEORGIA TECH, PURDUE, VIRGINIA TECH, UVA","DUKE, UMICH, WASHU","STANFORD, NORTHWESTERN",5,3,2
F,WHITE,MA,Low,NA,NONE,PSYCH,1430,2,8,['*EMORY'],[],[],NA,EMORY,,,1,0,0
M,ASIAN,NA,Low,PUBLIC,NONE,CS,1590,7.5,8.7,"['*YALE', '*GEORGIA TECH', '*SWARTHMORE', '*CMU', '*UPENN']","['*HARVARD', '*CORNELL', '*PRINCETON', '*MIT']","['*BROWN', '*STANFORD', '*COLUMBIA', '*CALTECH', '*UCHICAGO']",NA,"YALE, GEORGIA TECH, SWARTHMORE, CMU, UPENN","HARVARD, CORNELL, PRINCETON, MIT","BROWN, STANFORD, COLUMBIA, CALTECH, UCHICAGO",5,4,5
F,NA,CA,Low,PUBLIC,URM,ENG,1280,2,4.5,"['*BERKELEY', '*NYU', '*UCD', '*FORDHAM', '*UCHICAGO']",['*UCLA'],"['*HARVARD', '*STANFORD', '*BERKELEY', '*NYU']",NA,"BERKELEY, NYU, UCD, FORDHAM, UCHICAGO",UCLA,"HARVARD, STANFORD, BERKELEY, NYU",5,1,4
F,ASIAN,WA,Low,PRIVATE,LEGACY,POLISCI,1570,7.5,4.2,['*UCHICAGO'],[],[],NA,UCHICAGO,,,1,0,0
M,WHITE,TX,Low,NA,NONE,LAW,1560,6.5,3.5,"['*COLUMBIA', '*UT-AUSTIN', '*TAMU']",[],"['*YALE', '*COLUMBIA']",NA,"COLUMBIA, UT-AUSTIN, TAMU",,"YALE, COLUMBIA",3,0,2
F,BLACK,FL,Low,PUBLIC,URM,HISTORY,1500,7.5,4.7,['*YALE'],['*COLUMBIA'],"['*HARVARD', '*CORNELL']",NA,YALE,COLUMBIA,"HARVARD, CORNELL",1,1,2
M,WHITE,CA,Low,PUBLIC,NONE,BIO,1540,7.5,7.3,"['*UCLA', '*STANFORD', '*MIT', '*UCSB', '*UCD']",['*TULANE'],[],NA,"UCLA, STANFORD, MIT, UCSB, UCD",TULANE,,5,1,0
M,ASIAN,INTERNATIONAL,Low,NA,NONE,CS,1510,7.5,6.2,['*UPENN'],[],[],NA,UPENN,,,1,0,0
F,WHITE,CA,Low,PUBLIC,NONE,CS,1490,7.5,4.5,"['*MIT', '*JOHNS HOPKINS', '*WASHU']",[],['*CALTECH'],NA,"MIT, JOHNS HOPKINS, WASHU",,CALTECH,3,0,1
M,BLACK,PA,Low,PRIVATE,URM,BIO,1520,5.5,4.5,"['*CMU', '*TUFTS']",['*HARVARD'],"['*HARVARD', '*BROWN', '*CORNELL', '*JOHNS HOPKINS', '*DARTMOUTH', '*UPENN']",NA,"CMU, TUFTS",HARVARD,"HARVARD, BROWN, CORNELL, JOHNS HOPKINS, DARTMOUTH, UPENN",2,1,6
F,BLACK,CA,Low,PRIVATE,URM,CS,1320,5,5.7,['*UPENN'],[],['*NYU'],NA,UPENN,,NYU,1,0,1
M,ASIAN,WA,Low,NA,NONE,CS,1570,4.5,1.5,"['*NYU', '*NORTHEASTERN']",[],['*CLAREMONT MCKENNA'],NA,"NYU, NORTHEASTERN",,CLAREMONT MCKENNA,2,0,1
F,WHITE,NY,Low,NA,URM,MEDIA STUDIES,1240,4.5,2,['*UPENN'],[],"['*CMU', '*UPENN', '*UMICH', '*USC', '*BOSTON UNIVERSITY', '*NORTHEASTERN']",NA,UPENN,,"CMU, UPENN, UMICH, USC, BOSTON UNIVERSITY, NORTHEASTERN",1,0,6
M,ASIAN,GA,High,NA,NONE,CS,1480,5,4.5,[],[],"['*HARVARD', '*COLUMBIA', '*DARTMOUTH', '*NYU', '*NORTHEASTERN']",NA,,,"HARVARD, COLUMBIA, DARTMOUTH, NYU, NORTHEASTERN",0,0,5
F,ASIAN,CA,High,PUBLIC,NONE,BIO,1430,5.5,4.2,"['*UCSD', '*UCR', '*UCI']",[],"['*UCLA', '*HARVARD', '*BROWN', '*STANFORD', '*COLUMBIA', '*CORNELL', '*BERKELEY', '*JOHNS HOPKINS', '*POMONA', '*UPENN', '*UMICH', '*UCD', '*HARVEY MUDD']",NA,"UCSD, UCR, UCI",,"UCLA, HARVARD, BROWN, STANFORD, COLUMBIA, CORNELL, BERKELEY, JOHNS HOPKINS, POMONA, UPENN, UMICH, UCD, HARVEY MUDD",3,0,13
F,ASIAN,CA,Low,NA,NONE,CS,1570,8.5,4.5,"['*PURDUE', '*POMONA', '*NYU', '*UMICH', '*UCSB', '*UCD', '*UCSC', '*UCR', '*UIUC', '*RUTGERS', '*San Jose State University']","['*UCSD', '*GEORGIA TECH', '*UCHICAGO', '*UCI']","['*UCLA', '*HARVARD', '*BROWN', '*STANFORD', '*COLUMBIA', '*CORNELL', '*BERKELEY', '*DUKE', '*CMU', '*RICE', '*UPENN', '*UT-AUSTIN']",NA,"PURDUE, POMONA, NYU, UMICH, UCSB, UCD, UCSC, UCR, UIUC, RUTGERS, San Jose State University","UCSD, GEORGIA TECH, UCHICAGO, UCI","UCLA, HARVARD, BROWN, STANFORD, COLUMBIA, CORNELL, BERKELEY, DUKE, CMU, RICE, UPENN, UT-AUSTIN",11,4,12
M,NA,CA,Low,PUBLIC,NONE,CS,1540,8.5,4.7,"['*UCLA', '*CORNELL', '*BERKELEY', '*USC', '*UCI']","['*HARVARD', '*BROWN', '*DARTMOUTH', '*VANDERBILT', '*NYU', '*UCHICAGO']","['*YALE', '*STANFORD', '*NORTHWESTERN', '*COLUMBIA', '*DUKE', '*PRINCETON', '*UPENN']",NA,"UCLA, CORNELL, BERKELEY, USC, UCI","HARVARD, BROWN, DARTMOUTH, VANDERBILT, NYU, UCHICAGO","YALE, STANFORD, NORTHWESTERN, COLUMBIA, DUKE, PRINCETON, UPENN",5,6,7
M,ASIAN,DC,Low,PUBLIC,FIRST-GEN,CHEMISTRY,1570,3.5,6.5,[],['*TULANE'],"['*YALE', '*BROWN', '*JOHNS HOPKINS', '*SWARTHMORE', '*UPENN']",NA,,TULANE,"YALE, BROWN, JOHNS HOPKINS, SWARTHMORE, UPENN",0,1,5
F,BLACK,IN,Low,PRIVATE,NONE,CS,1420,6.5,7.5,"['*BROWN', '*JOHNS HOPKINS', '*BOSTON UNIVERSITY', '*FORDHAM']",[],"['*HARVARD', '*YALE', '*NORTHWESTERN', '*JOHNS HOPKINS', '*NYU', '*UPENN', '*TUFTS']",NA,"BROWN, JOHNS HOPKINS, BOSTON UNIVERSITY, FORDHAM",,"HARVARD, YALE, NORTHWESTERN, JOHNS HOPKINS, NYU, UPENN, TUFTS",4,0,7
F,WHITE,MI,High,PUBLIC,NONE,BIO,1430,3.5,4.5,['*UCD'],"['*CASE WESTERN', '*TULANE']","['*UCSD', '*RICE', '*UCSB']",NA,UCD,"CASE WESTERN, TULANE","UCSD, RICE, UCSB",1,2,3
F,BLACK,MO,Low,PUBLIC,URM,CS,1420,6.5,7.5,"['*RICE', '*EMORY', '*USC', '*TUFTS']","['*NORTHWESTERN', '*WILLIAMS', '*COLGATE']","['*BROWN', '*COLUMBIA', '*DUKE', '*PRINCETON', '*DARTMOUTH', '*POMONA']",NA,"RICE, EMORY, USC, TUFTS","NORTHWESTERN, WILLIAMS, COLGATE","BROWN, COLUMBIA, DUKE, PRINCETON, DARTMOUTH, POMONA",4,3,6
F,WHITE,MI,High,PUBLIC,NONE,BUSINESS,1190,1,4.5,['*USC'],[],[],NA,USC,,,1,0,0
M,ASIAN,OR,High,PUBLIC,NONE,BIO,1410,5.5,7.5,"['*MIT', '*UPENN']",[],"['*HARVARD', '*GEORGIA TECH', '*SWARTHMORE', '*COLGATE', '*TULANE', '*UVA']",NA,"MIT, UPENN",,"HARVARD, GEORGIA TECH, SWARTHMORE, COLGATE, TULANE, UVA",2,0,6
M,ASIAN,NA,Middle,PUBLIC,NONE,CS,1330,2.5,5.7,"['*PURDUE', '*UIUC', '*RUTGERS', '*VIRGINIA TECH', '*NORTHEASTERN', '*UVA']",['*UMICH'],"['*CORNELL', '*GEORGIA TECH', '*NYU']",NA,"PURDUE, UIUC, RUTGERS, VIRGINIA TECH, NORTHEASTERN, UVA",UMICH,"CORNELL, GEORGIA TECH, NYU",6,1,3
F,HISPANIC,CA,High,PUBLIC,NONE,NEUROSCIENCE,1380,7.5,6.5,"['*USC', '*HARVEY MUDD']",[],['*DUKE'],NA,"USC, HARVEY MUDD",,DUKE,2,0,1
F,ASIAN,NY,High,PUBLIC,NONE,HISTORY,1590,6.5,8.1,"['*CORNELL', '*NYU', '*EMORY', '*BOSTON UNIVERSITY', '*NORTHEASTERN', '*UNC CHAPEL HILL', '*UVA']",[],"['*HARVARD', '*YALE', '*COLUMBIA']",NA,"CORNELL, NYU, EMORY, BOSTON UNIVERSITY, NORTHEASTERN, UNC CHAPEL HILL, UVA",,"HARVARD, YALE, COLUMBIA",7,0,3
F,ASIAN,NY,Low,PUBLIC,NONE,CS,1600,6.5,7.5,"['*UMICH', '*CASE WESTERN', '*UCHICAGO', '*ARIZONA STATE']",[],"['*HARVARD', '*YALE', '*BROWN', '*NORTHWESTERN', '*CORNELL', '*PRINCETON', '*JOHNS HOPKINS', '*SWARTHMORE', '*RICE', '*POMONA', '*NYU', '*UPENN', '*EMORY', '*BOSTON UNIVERSITY']",NA,"UMICH, CASE WESTERN, UCHICAGO, ARIZONA STATE",,"HARVARD, YALE, BROWN, NORTHWESTERN, CORNELL, PRINCETON, JOHNS HOPKINS, SWARTHMORE, RICE, POMONA, NYU, UPENN, EMORY, BOSTON UNIVERSITY",4,0,14
M,ASIAN,MI,High,PUBLIC,NONE,NA,1530,7.5,4.5,['*CORNELL'],[],[],NA,CORNELL,,,1,0,0
M,WHITE,CA,Low,PUBLIC,NONE,CS,1460,3.5,2.5,"['*UCD', '*ARIZONA STATE']","['*UCSC', '*UIUC']","['*UCLA', '*BERKELEY', '*UCSD', '*CALTECH', '*UCSB', '*UCI']",NA,"UCD, ARIZONA STATE","UCSC, UIUC","UCLA, BERKELEY, UCSD, CALTECH, UCSB, UCI",2,2,6
M,ASIAN,INTERNATIONAL,High,PRIVATE,NONE,CS,1570,4.5,3.7,[],"['*NORTHWESTERN', '*CMU']",['*CMU'],NA,,"NORTHWESTERN, CMU",CMU,0,2,1
M,ASIAN,IL,Low,PUBLIC,NONE,ENG,1400,5,4.5,"['*PURDUE', '*UPENN', '*UIUC', '*VIRGINIA TECH', '*UVA']",[],[],NA,"PURDUE, UPENN, UIUC, VIRGINIA TECH, UVA",,,5,0,0
M,ASIAN,OR,Low,PUBLIC,FIRST-GEN,CS,1530,3.5,3.7,"['*HARVARD', '*YALE', '*STANFORD', '*COLUMBIA', '*PRINCETON', '*MIT', '*CALTECH', '*JOHNS HOPKINS', '*NORTHEASTERN']",['*CASE WESTERN'],['*NORTHWESTERN'],NA,"HARVARD, YALE, STANFORD, COLUMBIA, PRINCETON, MIT, CALTECH, JOHNS HOPKINS, NORTHEASTERN",CASE WESTERN,NORTHWESTERN,9,1,1
F,BLACK,NY,Low,PUBLIC,URM,ENG,1390,5.5,4.2,['*FORDHAM'],['*NORTHEASTERN'],"['*POMONA', '*NYU', '*USC', '*TUFTS']",NA,FORDHAM,NORTHEASTERN,"POMONA, NYU, USC, TUFTS",1,1,4
M,WHITE,INTERNATIONAL,Low,PRIVATE,FIRST-GEN,CS,1540,6.5,7.2,[],[],"['*HARVARD', '*NORTHWESTERN', '*CORNELL']",NA,,,"HARVARD, NORTHWESTERN, CORNELL",0,0,3
M,WHITE,CA,High,PUBLIC,NONE,NA,1470,6.5,7.5,"['*UCLA', '*UCSB', '*BOSTON COLLEGE', '*NORTHEASTERN', '*UCI']","['*WASHU', '*CLAREMONT MCKENNA']","['*HARVARD', '*BROWN', '*STANFORD', '*BERKELEY', '*POMONA']",NA,"UCLA, UCSB, BOSTON COLLEGE, NORTHEASTERN, UCI","WASHU, CLAREMONT MCKENNA","HARVARD, BROWN, STANFORD, BERKELEY, POMONA",5,2,5
F,WHITE,NA,Low,PUBLIC,FIRST-GEN,MEDIA STUDIES,1420,5,6.5,"['*UPENN', '*FORDHAM']",['*NYU'],['*COLUMBIA'],NA,"UPENN, FORDHAM",NYU,COLUMBIA,2,1,1
M,BLACK,GA,High,PUBLIC,URM,BUSINESS,1380,2.5,5.5,[],['*GEORGIA TECH'],"['*HARVARD', '*COLUMBIA', '*UPENN']",NA,,GEORGIA TECH,"HARVARD, COLUMBIA, UPENN",0,1,3
M,ASIAN,IL,Low,NA,NONE,PSYCH,1470,6.5,3.5,[],"['*GEORGIA TECH', '*NORTHEASTERN', '*UCI']","['*UCLA', '*NORTHWESTERN', '*VANDERBILT', '*UCSC']",NA,,"GEORGIA TECH, NORTHEASTERN, UCI","UCLA, NORTHWESTERN, VANDERBILT, UCSC",0,3,4
F,WHITE,CA,High,NA,URM,BIO,1080,3.5,1.5,"['*UCLA', '*UCSD', '*UCSB', '*UCR', '*UCI']",[],[],NA,"UCLA, UCSD, UCSB, UCR, UCI",,,5,0,0
M,ASIAN,OH,NA,PUBLIC,NONE,NA,1490,6.5,0,"['*UCSD', '*PURDUE', '*UPENN', '*CASE WESTERN']",[],"['*NYU', '*EMORY', '*CASE WESTERN']",NA,"UCSD, PURDUE, UPENN, CASE WESTERN",,"NYU, EMORY, CASE WESTERN",4,0,3
F,WHITE,OR,Low,SMALL,FIRST-GEN,DESIGN,1410,2,4.5,['*UPENN'],"['*VIRGINIA TECH', '*UVA']","['*GEORGIA TECH', '*NORTHEASTERN']",NA,UPENN,"VIRGINIA TECH, UVA","GEORGIA TECH, NORTHEASTERN",1,2,2
F,WHITE,CA,Low,NA,NONE,ENVIRONMENTAL STUDIES,1350,4.5,2,['*UCI'],[],['*UCLA'],NA,UCI,,UCLA,1,0,1
F,ASIAN,CA,High,PRIVATE,NONE,CHEMISTRY,1560,6.5,2.5,"['*CMU', '*PURDUE', '*UCSB', '*UCD', '*UIUC']","['*UCSD', '*NYU', '*UCHICAGO', '*UCI']","['*UCLA', '*HARVARD', '*YALE', '*BROWN', '*STANFORD', '*COLUMBIA', '*BERKELEY', '*DUKE', '*PRINCETON', '*MIT', '*CALTECH', '*CMU', '*UPENN', '*USC']",NA,"CMU, PURDUE, UCSB, UCD, UIUC","UCSD, NYU, UCHICAGO, UCI","UCLA, HARVARD, YALE, BROWN, STANFORD, COLUMBIA, BERKELEY, DUKE, PRINCETON, MIT, CALTECH, CMU, UPENN, USC",5,4,14
M,ASIAN,WA,Low,NA,LEGACY,ENG,1380,5.5,4.5,"['*UCD', '*UCI']",['*BERKELEY'],['*UCLA'],NA,"UCD, UCI",BERKELEY,UCLA,2,1,1
F,ASIAN,CO,High,CHARTER,NONE,NA,1500,6.5,6.5,['*CASE WESTERN'],"['*DARTMOUTH', '*EMORY', '*BOSTON COLLEGE']","['*BROWN', '*NORTHWESTERN', '*CORNELL', '*DUKE', '*JOHNS HOPKINS', '*VANDERBILT', '*NORTHEASTERN']",NA,CASE WESTERN,"DARTMOUTH, EMORY, BOSTON COLLEGE","BROWN, NORTHWESTERN, CORNELL, DUKE, JOHNS HOPKINS, VANDERBILT, NORTHEASTERN",1,3,7
M,HISPANIC,CA,Low,PUBLIC,URM,NA,1330,5.5,6.8,"['*UCLA', '*STANFORD', '*BERKELEY', '*CALTECH']","['*HARVARD', '*MIT']",['*COLUMBIA'],NA,"UCLA, STANFORD, BERKELEY, CALTECH","HARVARD, MIT",COLUMBIA,4,2,1
M,BLACK,CO,High,PUBLIC,URM,PREMED,1370,6.5,3.5,"['*NORTHWESTERN', '*CORNELL', '*VANDERBILT', '*EMORY', '*CASE WESTERN', '*USC']","['*DUKE', '*JOHNS HOPKINS', '*UPENN']","['*YALE', '*UPENN']",NA,"NORTHWESTERN, CORNELL, VANDERBILT, EMORY, CASE WESTERN, USC","DUKE, JOHNS HOPKINS, UPENN","YALE, UPENN",6,3,2
M,ASIAN,NA,High,PUBLIC,FIRST-GEN,CHEMISTRY,1300,6,7.5,"['*UMICH', '*UCD', '*FORDHAM', '*UCI']","['*UCLA', '*UCSD']","['*BROWN', '*WILLIAMS', '*USC', '*BOSTON UNIVERSITY']",NA,"UMICH, UCD, FORDHAM, UCI","UCLA, UCSD","BROWN, WILLIAMS, USC, BOSTON UNIVERSITY",4,2,4
M,WHITE,IL,High,PUBLIC,NONE,CS,1530,5,7,"['*PURDUE', '*UMICH', '*UW MADISON', '*ARIZONA STATE']",[],['*UIUC'],NA,"PURDUE, UMICH, UW MADISON, ARIZONA STATE",,UIUC,4,0,1
M,BLACK,OR,Low,PUBLIC,URM,NA,1450,6.5,4.2,"['*HARVARD', '*COLUMBIA', '*CORNELL', '*MIT', '*CALTECH', '*UCHICAGO']",[],"['*UCLA', '*HARVARD', '*YALE', '*BROWN', '*COLUMBIA', '*UPENN']",NA,"HARVARD, COLUMBIA, CORNELL, MIT, CALTECH, UCHICAGO",,"UCLA, HARVARD, YALE, BROWN, COLUMBIA, UPENN",6,0,6
F,WHITE,TX,Low,PUBLIC,URM,CS,1420,5.5,4.5,"['*CORNELL', '*CMU', '*UT-AUSTIN', '*NORTHEASTERN']",[],"['*HARVARD', '*CALTECH', '*SWARTHMORE']",NA,"CORNELL, CMU, UT-AUSTIN, NORTHEASTERN",,"HARVARD, CALTECH, SWARTHMORE",4,0,3
F,ARAB,OR,High,PUBLIC,LEGACY,BUSINESS,1430,5.5,7.5,"['*UCLA', '*BERKELEY', '*DUKE', '*UPENN', '*UIUC', '*NORTHEASTERN', '*UNC CHAPEL HILL']",[],"['*BROWN', '*STANFORD', '*COLUMBIA', '*VANDERBILT']",NA,"UCLA, BERKELEY, DUKE, UPENN, UIUC, NORTHEASTERN, UNC CHAPEL HILL",,"BROWN, STANFORD, COLUMBIA, VANDERBILT",7,0,4
M,ASIAN,GA,Low,PUBLIC,FIRST-GEN,CS,1530,3.5,4.2,['*CALTECH'],[],[],NA,CALTECH,,,1,0,0
M,ASIAN,CA,Low,PUBLIC,FIRST-GEN,ENG,1460,6.5,4.2,"['*UCSD', '*JOHNS HOPKINS', '*POMONA', '*UCSB', '*UCI']",['*UCLA'],"['*CORNELL', '*BERKELEY', '*DUKE', '*CMU', '*USC']",NA,"UCSD, JOHNS HOPKINS, POMONA, UCSB, UCI",UCLA,"CORNELL, BERKELEY, DUKE, CMU, USC",5,1,5
M,HISPANIC,IL,NA,PUBLIC,FIRST-GEN,ENG,1390,8.5,2.5,['*CORNELL'],[],"['*COLUMBIA', '*MIT']",NA,CORNELL,,"COLUMBIA, MIT",1,0,2
M,WHITE,CA,High,PUBLIC,LEGACY,CS,1480,5,4.7,"['*USC', '*UIUC', '*UW MADISON']","['*UMICH', '*TULANE']","['*NORTHWESTERN', '*COLUMBIA', '*CORNELL', '*DARTMOUTH', '*NYU']",NA,"USC, UIUC, UW MADISON","UMICH, TULANE","NORTHWESTERN, COLUMBIA, CORNELL, DARTMOUTH, NYU",3,2,5
M,HISPANIC,MA,High,PUBLIC,URM,ENG,1520,4.5,6.5,['*BOSTON UNIVERSITY'],[],['*NORTHEASTERN'],NA,BOSTON UNIVERSITY,,NORTHEASTERN,1,0,1
M,ASIAN,CA,High,PUBLIC,NONE,CS,1580,8.5,4.5,['*BERKELEY'],[],"['*HARVARD', '*STANFORD', '*PRINCETON', '*MIT']",NA,BERKELEY,,"HARVARD, STANFORD, PRINCETON, MIT",1,0,4
F,WHITE,LA,Low,NA,LEGACY,BIO,1530,6.5,4.2,[],[],"['*BROWN', '*WILLIAMS']",NA,,,"BROWN, WILLIAMS",0,0,2
M,ASIAN,CO,Low,NA,FIRST-GEN,BUSINESS,1530,2.5,3.5,"['*MIT', '*EMORY', '*NORTHEASTERN']","['*NORTHWESTERN', '*UMICH', '*BOSTON COLLEGE', '*UVA', '*UCI']","['*UCLA', '*YALE', '*CORNELL', '*BERKELEY', '*NYU', '*UPENN', '*EMORY', '*UCHICAGO']",NA,"MIT, EMORY, NORTHEASTERN","NORTHWESTERN, UMICH, BOSTON COLLEGE, UVA, UCI","UCLA, YALE, CORNELL, BERKELEY, NYU, UPENN, EMORY, UCHICAGO",3,5,8
F,ASIAN,CA,Low,NA,NONE,NA,1530,1,2.5,"['*UCSD', '*UCSB', '*UCD']",['*UCLA'],"['*STANFORD', '*BERKELEY', '*UMICH']",NA,"UCSD, UCSB, UCD",UCLA,"STANFORD, BERKELEY, UMICH",3,1,3
NB,WHITE,MA,Middle,NA,NONE,POLISCI,1500,3.5,1.5,[],['*CLAREMONT MCKENNA'],"['*SWARTHMORE', '*POMONA']",NA,,CLAREMONT MCKENNA,"SWARTHMORE, POMONA",0,1,2
M,ASIAN,MA,High,PUBLIC,NONE,CS,1560,6.5,6.5,"['*PURDUE', '*NYU']","['*UMICH', '*NORTHEASTERN']","['*UCLA', '*HARVARD', '*BROWN', '*BERKELEY', '*DARTMOUTH', '*CMU', '*NYU', '*UPENN', '*UT-AUSTIN', '*UVA']",NA,"PURDUE, NYU","UMICH, NORTHEASTERN","UCLA, HARVARD, BROWN, BERKELEY, DARTMOUTH, CMU, NYU, UPENN, UT-AUSTIN, UVA",2,2,10
F,ASIAN,OR,High,PUBLIC,NONE,ENG,1560,6.5,4.5,"['*CORNELL', '*CASE WESTERN', '*UVA']","['*GEORGIA TECH', '*RICE', '*UMICH']","['*COLUMBIA', '*MIT', '*UPENN']",NA,"CORNELL, CASE WESTERN, UVA","GEORGIA TECH, RICE, UMICH","COLUMBIA, MIT, UPENN",3,3,3
M,WHITE,UT,Low,PUBLIC,URM,CS,1460,5,4.5,"['*CORNELL', '*MIT', '*CALTECH', '*CMU', '*USC']","['*RICE', '*UNC CHAPEL HILL']","['*YALE', '*BROWN', '*STANFORD', '*PRINCETON', '*UPENN']",NA,"CORNELL, MIT, CALTECH, CMU, USC","RICE, UNC CHAPEL HILL","YALE, BROWN, STANFORD, PRINCETON, UPENN",5,2,5
F,BLACK,NA,Low,NA,URM,BUSINESS,1430,6.5,4.5,"['*BOSTON COLLEGE', '*RUTGERS']",[],"['*YALE', '*SWARTHMORE', '*UPENN', '*EMORY', '*USC']",NA,"BOSTON COLLEGE, RUTGERS",,"YALE, SWARTHMORE, UPENN, EMORY, USC",2,0,5
M,ASIAN,CO,High,PUBLIC,FIRST-GEN,NA,1430,5.5,2.5,"['*CORNELL', '*SWARTHMORE', '*POMONA', '*UW MADISON']","['*RICE', '*WASHU', '*UCHICAGO']","['*HARVARD', '*YALE', '*BROWN', '*STANFORD', '*NORTHWESTERN', '*COLUMBIA', '*DUKE', '*PRINCETON', '*MIT', '*DARTMOUTH', '*UPENN']",NA,"CORNELL, SWARTHMORE, POMONA, UW MADISON","RICE, WASHU, UCHICAGO","HARVARD, YALE, BROWN, STANFORD, NORTHWESTERN, COLUMBIA, DUKE, PRINCETON, MIT, DARTMOUTH, UPENN",4,3,11
M,ASIAN,CA,Low,PUBLIC,URM,CS,1100,5,7.2,"['*UCLA', '*BERKELEY', '*UCSD', '*POMONA', '*UCSB', '*UCD', '*CLAREMONT MCKENNA']",['*WILLIAMS'],"['*HARVARD', '*STANFORD', '*COLUMBIA', '*MIT', '*DARTMOUTH', '*VANDERBILT', '*UPENN', '*USC', '*San Jose State University']",NA,"UCLA, BERKELEY, UCSD, POMONA, UCSB, UCD, CLAREMONT MCKENNA",WILLIAMS,"HARVARD, STANFORD, COLUMBIA, MIT, DARTMOUTH, VANDERBILT, UPENN, USC, San Jose State University",7,1,9
F,HISPANIC,FL,Low,PUBLIC,NONE,DESIGN,1320,5.5,8.7,"['*CMU', '*WASHU']",['*CORNELL'],['*MIT'],NA,"CMU, WASHU",CORNELL,MIT,2,1,1
M,ASIAN,NY,Low,PUBLIC,FIRST-GEN,CS,1370,2,2.5,[],[],"['*NYU', '*FORDHAM']",NA,,,"NYU, FORDHAM",0,0,2
M,ASIAN,DC,Low,PUBLIC,NONE,BIO,1440,8.5,8.2,"['*UMICH', '*UNC CHAPEL HILL']",['*UPENN'],"['*HARVARD', '*YALE', '*BROWN', '*STANFORD', '*JOHNS HOPKINS', '*RICE', '*VANDERBILT']",NA,"UMICH, UNC CHAPEL HILL",UPENN,"HARVARD, YALE, BROWN, STANFORD, JOHNS HOPKINS, RICE, VANDERBILT",2,1,7
M,ASIAN,NA,Low,PUBLIC,FIRST-GEN,BUSINESS,1480,5.5,7.2,[],"['*UPENN', '*EMORY', '*BOSTON COLLEGE']","['*COLUMBIA', '*CORNELL', '*CMU', '*NYU', '*UPENN', '*USC', '*NORTHEASTERN', '*UVA']",NA,,"UPENN, EMORY, BOSTON COLLEGE","COLUMBIA, CORNELL, CMU, NYU, UPENN, USC, NORTHEASTERN, UVA",0,3,8
M,WHITE,MD,Low,PUBLIC,NONE,UNDECIDED,1460,2,3.5,['*UW MADISON'],['*EMORY'],"['*UCLA', '*BERKELEY', '*UMICH', '*EMORY', '*UCSB', '*UVA']",NA,UW MADISON,EMORY,"UCLA, BERKELEY, UMICH, EMORY, UCSB, UVA",1,1,6
M,ASIAN,CA,High,PUBLIC,NONE,CS,1440,7.5,4.5,"['*UCLA', '*YALE', '*BROWN', '*COLUMBIA', '*CORNELL', '*DUKE', '*UCSD', '*GEORGIA TECH', '*PURDUE', '*USC', '*UCSB', '*UCD', '*UIUC', '*UT-AUSTIN', '*VIRGINIA TECH', '*TUFTS', '*UVA', '*TAMU', '*UCI']",[],"['*UCLA', '*YALE', '*BROWN', '*COLUMBIA', '*CORNELL', '*DUKE', '*UCSD', '*GEORGIA TECH', '*CMU', '*UMICH', '*CASE WESTERN', '*USC', '*UCSB', '*UCD', '*UCSC', '*UT-AUSTIN', '*TUFTS', '*UCI']",NA,"UCLA, YALE, BROWN, COLUMBIA, CORNELL, DUKE, UCSD, GEORGIA TECH, PURDUE, USC, UCSB, UCD, UIUC, UT-AUSTIN, VIRGINIA TECH, TUFTS, UVA, TAMU, UCI",,"UCLA, YALE, BROWN, COLUMBIA, CORNELL, DUKE, UCSD, GEORGIA TECH, CMU, UMICH, CASE WESTERN, USC, UCSB, UCD, UCSC, UT-AUSTIN, TUFTS, UCI",19,0,18
M,ASIAN,NY,Low,NA,NONE,NA,1510,3.5,2.5,"['*CMU', '*NORTHEASTERN']","['*NYU', '*UMICH']","['*WASHU', '*UVA']",NA,"CMU, NORTHEASTERN","NYU, UMICH","WASHU, UVA",2,2,2
M,WHITE,MD,Low,PUBLIC,NONE,UNDECIDED,1460,2,3.5,['*UW MADISON'],['*EMORY'],"['*UCLA', '*BERKELEY', '*UMICH', '*EMORY', '*UCSB', '*UVA']",NA,UW MADISON,EMORY,"UCLA, BERKELEY, UMICH, EMORY, UCSB, UVA",1,1,6
F,ASIAN,CA,Low,PUBLIC,LEGACY,LAW,1490,7.5,4.5,"['*UCSD', '*USC', '*UCD', '*UCSC', '*BOSTON UNIVERSITY', '*San Jose State University']",['*BERKELEY'],"['*UCLA', '*HARVARD', '*STANFORD', '*NORTHWESTERN', '*COLUMBIA', '*CORNELL', '*WILLIAMS', '*NYU', '*UPENN', '*UMICH']",NA,"UCSD, USC, UCD, UCSC, BOSTON UNIVERSITY, San Jose State University",BERKELEY,"UCLA, HARVARD, STANFORD, NORTHWESTERN, COLUMBIA, CORNELL, WILLIAMS, NYU, UPENN, UMICH",6,1,10
M,ASIAN,MI,Low,PUBLIC,NONE,CS,1550,6.5,6.5,"['*CMU', '*UMICH', '*BOSTON COLLEGE', '*NORTHEASTERN']","['*WILLIAMS', '*VANDERBILT', '*WASHU', '*UVA']","['*DUKE', '*UCHICAGO']",NA,"CMU, UMICH, BOSTON COLLEGE, NORTHEASTERN","WILLIAMS, VANDERBILT, WASHU, UVA","DUKE, UCHICAGO",4,4,2
M,WHITE,FL,Low,PUBLIC,NONE,BIO,1390,5,4.5,"['*NORTHWESTERN', '*DUKE', '*DARTMOUTH', '*RICE', '*UMICH', '*EMORY', '*UNC CHAPEL HILL', '*UVA']",['*GEORGIA TECH'],"['*HARVARD', '*YALE', '*COLUMBIA', '*PRINCETON', '*USC']",NA,"NORTHWESTERN, DUKE, DARTMOUTH, RICE, UMICH, EMORY, UNC CHAPEL HILL, UVA",GEORGIA TECH,"HARVARD, YALE, COLUMBIA, PRINCETON, USC",8,1,5
M,ASIAN,ID,High,PUBLIC,FIRST-GEN,CS,1430,5.5,2.5,[],['*CASE WESTERN'],"['*VANDERBILT', '*BOSTON COLLEGE', '*NORTHEASTERN']",NA,,CASE WESTERN,"VANDERBILT, BOSTON COLLEGE, NORTHEASTERN",0,1,3
F,BLACK,CA,Low,PUBLIC,URM,BIO,1080,1.5,6.2,['*UCD'],[],"['*HARVARD', '*YALE', '*BROWN', '*STANFORD', '*COLUMBIA', '*CORNELL', '*BERKELEY', '*DUKE', '*PRINCETON', '*JOHNS HOPKINS', '*DARTMOUTH', '*NYU', '*UPENN', '*UMICH', '*EMORY', '*BOSTON UNIVERSITY', '*UT-AUSTIN', '*TULANE', '*UCHICAGO', '*UCI', '*UCM']",NA,UCD,,"HARVARD, YALE, BROWN, STANFORD, COLUMBIA, CORNELL, BERKELEY, DUKE, PRINCETON, JOHNS HOPKINS, DARTMOUTH, NYU, UPENN, UMICH, EMORY, BOSTON UNIVERSITY, UT-AUSTIN, TULANE, UCHICAGO, UCI, UCM",1,0,21
M,ASIAN,IN,Low,PRIVATE,NONE,ENG,1460,6,4.5,['*UPENN'],"['*VIRGINIA TECH', '*UVA']",['*NORTHWESTERN'],NA,UPENN,"VIRGINIA TECH, UVA",NORTHWESTERN,1,2,1
T,WHITE,NY,Low,PRIVATE,NONE,CS,1600,6.5,4.5,"['*UCD', '*UCSC']","['*UCSD', '*UMICH']",[],NA,"UCD, UCSC","UCSD, UMICH",,2,2,0
M,ASIAN,AZ,High,PUBLIC,NONE,BUSINESS,1480,6.5,4.5,['*ARIZONA STATE'],[],"['*BERKELEY', '*NYU', '*UPENN', '*UMICH', '*BOSTON COLLEGE']",NA,ARIZONA STATE,,"BERKELEY, NYU, UPENN, UMICH, BOSTON COLLEGE",1,0,5
M,WHITE,CA,Low,PUBLIC,NONE,CS,1530,6.5,4.2,"['*BERKELEY', '*UCSD', '*UCSB', '*UCD', '*UCSC', '*ARIZONA STATE', '*UCI']","['*UCLA', '*GEORGIA TECH', '*CMU']","['*STANFORD', '*NORTHWESTERN', '*CORNELL', '*BERKELEY', '*DUKE', '*MIT', '*CALTECH', '*UPENN', '*UIUC', '*HARVEY MUDD']",NA,"BERKELEY, UCSD, UCSB, UCD, UCSC, ARIZONA STATE, UCI","UCLA, GEORGIA TECH, CMU","STANFORD, NORTHWESTERN, CORNELL, BERKELEY, DUKE, MIT, CALTECH, UPENN, UIUC, HARVEY MUDD",7,3,10
F,NA,TX,Low,PUBLIC,NONE,PSYCH,1560,7.5,4.7,"['*UCLA', '*BERKELEY', '*DUKE', '*VANDERBILT', '*UT-AUSTIN']","['*YALE', '*RICE', '*WASHU']",[],NA,"UCLA, BERKELEY, DUKE, VANDERBILT, UT-AUSTIN","YALE, RICE, WASHU",,5,3,0
M,ASIAN,TX,Low,PUBLIC,NONE,NA,1550,7.5,4.5,"['*UCLA', '*UCSD', '*UCSB', '*UT-DALLAS', '*UW MADISON', '*TAMU']","['*BERKELEY', '*EMORY']","['*UCLA', '*NORTHWESTERN', '*DUKE', '*GEORGIA TECH', '*RICE', '*VANDERBILT', '*WASHU', '*UT-AUSTIN']",NA,"UCLA, UCSD, UCSB, UT-DALLAS, UW MADISON, TAMU","BERKELEY, EMORY","UCLA, NORTHWESTERN, DUKE, GEORGIA TECH, RICE, VANDERBILT, WASHU, UT-AUSTIN",6,2,8
F,ASIAN,CO,Low,PUBLIC,LEGACY,ENG,1450,6.5,4.5,"['*CMU', '*NORTHEASTERN']","['*CORNELL', '*UMICH']","['*COLUMBIA', '*CORNELL', '*MIT', '*UPENN', '*UMICH']",NA,"CMU, NORTHEASTERN","CORNELL, UMICH","COLUMBIA, CORNELL, MIT, UPENN, UMICH",2,2,5
M,BLACK,IL,Low,PUBLIC,URM,ENG,1000,5.5,6.5,"['*NORTHWESTERN', '*VANDERBILT', '*UIUC', '*NORTHEASTERN', '*TUFTS', '*ARIZONA STATE']",[],"['*DUKE', '*USC']",NA,"NORTHWESTERN, VANDERBILT, UIUC, NORTHEASTERN, TUFTS, ARIZONA STATE",,"DUKE, USC",6,0,2
M,ASIAN,TX,Low,PUBLIC,NONE,CS,1480,8.2,5.5,"['*BERKELEY', '*UIUC', '*UT-AUSTIN', '*TAMU']","['*CORNELL', '*GEORGIA TECH', '*CMU', '*PURDUE', '*RICE', '*UMICH']","['*HARVARD', '*STANFORD', '*NORTHWESTERN', '*COLUMBIA', '*DUKE', '*DARTMOUTH', '*UPENN']",NA,"BERKELEY, UIUC, UT-AUSTIN, TAMU","CORNELL, GEORGIA TECH, CMU, PURDUE, RICE, UMICH","HARVARD, STANFORD, NORTHWESTERN, COLUMBIA, DUKE, DARTMOUTH, UPENN",4,6,7
F,ASIAN,OR,Low,PUBLIC,NONE,BUSINESS,1560,6.5,6.5,"['*CMU', '*UMICH', '*BOSTON UNIVERSITY', '*WASHU', '*NORTHEASTERN', '*UNC CHAPEL HILL']","['*NYU', '*BOSTON COLLEGE']","['*CORNELL', '*UPENN']",NA,"CMU, UMICH, BOSTON UNIVERSITY, WASHU, NORTHEASTERN, UNC CHAPEL HILL","NYU, BOSTON COLLEGE","CORNELL, UPENN",6,2,2
M,ASIAN,NA,High,PRIVATE,NONE,NA,1460,6.5,8.5,"['*CORNELL', '*BOSTON COLLEGE', '*FORDHAM', '*RUTGERS']","['*DARTMOUTH', '*WILLIAMS', '*NYU', '*TUFTS']","['*COLUMBIA', '*NORTHEASTERN']",NA,"CORNELL, BOSTON COLLEGE, FORDHAM, RUTGERS","DARTMOUTH, WILLIAMS, NYU, TUFTS","COLUMBIA, NORTHEASTERN",4,4,2
M,WHITE,NY,Low,PUBLIC,NONE,NA,1560,7.5,6.8,"['*YALE', '*COLUMBIA', '*DARTMOUTH', '*RICE', '*VANDERBILT', '*WASHU']","['*BROWN', '*NORTHWESTERN', '*SWARTHMORE', '*WILLIAMS']","['*UCLA', '*HARVARD', '*DUKE', '*PRINCETON', '*MIT', '*NORTHEASTERN', '*TUFTS']",NA,"YALE, COLUMBIA, DARTMOUTH, RICE, VANDERBILT, WASHU","BROWN, NORTHWESTERN, SWARTHMORE, WILLIAMS","UCLA, HARVARD, DUKE, PRINCETON, MIT, NORTHEASTERN, TUFTS",6,4,7
M,ASIAN,DC,Low,PUBLIC,FIRST-GEN,CHEMISTRY,1570,3.5,6.2,['*JOHNS HOPKINS'],"['*CASE WESTERN', '*TULANE']","['*YALE', '*BROWN', '*SWARTHMORE', '*UPENN']",NA,JOHNS HOPKINS,"CASE WESTERN, TULANE","YALE, BROWN, SWARTHMORE, UPENN",1,2,4
M,WHITE,MI,High,PUBLIC,NONE,ENG,1460,8,7.5,"['*RICE', '*UMICH', '*UIUC', '*UT-AUSTIN']","['*UCLA', '*WILLIAMS', '*VANDERBILT', '*WASHU']","['*HARVARD', '*YALE', '*NORTHWESTERN', '*BERKELEY', '*POMONA', '*UCHICAGO', '*UNC CHAPEL HILL']",NA,"RICE, UMICH, UIUC, UT-AUSTIN","UCLA, WILLIAMS, VANDERBILT, WASHU","HARVARD, YALE, NORTHWESTERN, BERKELEY, POMONA, UCHICAGO, UNC CHAPEL HILL",4,4,7
F,WHITE,NY,High,NA,NONE,CS,1540,3.5,4.5,['*CORNELL'],['*COLGATE'],"['*HARVARD', '*BROWN', '*DARTMOUTH', '*VANDERBILT', '*UPENN', '*TUFTS', '*UCHICAGO']",NA,CORNELL,COLGATE,"HARVARD, BROWN, DARTMOUTH, VANDERBILT, UPENN, TUFTS, UCHICAGO",1,1,7
